{
  "artifact": {
    "artifact_id": "IEP-RUN-20260818T135846105713Z",
    "artifact_type": "IntentExecutionPlan",
    "version": 1,
    "schema_version": "v0.1",
    "brand_id": "fixture-brand-01",
    "task_id": "TASK-RUN-20260818T135846105713Z",
    "context_snapshot_ref": {
      "object_type": "ContextSnapshot",
      "object_id": "SNAP-INTD03-0001",
      "version": 1,
      "brand_id": "fixture-brand-01"
    },
    "source_run_id": "RUN-20260818T135846105713Z",
    "parent_references": [],
    "review_status": "PENDING",
    "created_at": "2026-08-18T13:58:46.105752+00:00",
    "created_by": "SYSTEM"
  },
  "task_type": "VIDEO_CONTENT_CREATION",
  "platform": "WECHAT_VIDEO",
  "goal_resolution": "AMBIGUOUS",
  "business_goal": null,
  "goal_candidates": [
    {
      "goal": "BRAND_STORY",
      "rationale": "任务原话强调‘用同一件羊绒大衣建立品牌长期价值’，聚焦于通过具体产品传递品牌理念与价值观，而非短期销售或单纯曝光，符合品牌故事目标中‘以产品为载体讲述品牌为何存在、如何思考’的特征。",
      "focus": "通过深度解读一件产品的设计逻辑、材料选择与使用场景，传递品牌的核心价值观和长期承诺。",
      "tradeoffs": "优点是能强化用户对品牌底层逻辑的信任，代价是内容需要更高信息密度和判断力，可能不如泛曝光内容易传播。",
      "expected_outcome": "适用于希望用户理解‘为什么这个品牌值得长期关注’的阶段，尤其适合已有明确品牌价值观但需具象化落地的场景。",
      "supporting_trace_refs": [
        "FACT:brand.values",
        "FACT:brand.tone",
        "FACT:product.name"
      ]
    },
    {
      "goal": "BRAND_AWARENESS",
      "rationale": "‘建立品牌长期价值’也可理解为提升品牌在目标人群中的认知深度与正面联想，尤其当该大衣作为代表性单品反复出现时，可强化品牌识别与心智占位。",
      "focus": "让目标用户更清晰地记住品牌是谁、代表什么风格与态度，通过高辨识度单品形成视觉与理念锚点。",
      "tradeoffs": "优点是有助于扩大品牌在潜在客群中的可见度和记忆度，代价是若缺乏独特叙事容易流于表面形象展示。",
      "expected_outcome": "适用于品牌已具备基础产品力，需在竞争环境中建立差异化认知的阶段。",
      "supporting_trace_refs": [
        "FACT:brand.positioning",
        "FACT:brand.target_customer_summary",
        "FACT:product.style_attributes"
      ]
    }
  ],
  "intent_summary": "本次任务明确表示不以本期销量为主要目标，而是希望通过同一件羊绒大衣建立品牌长期价值。这已超出日常内容经营范畴，属于明示的品牌类经营意图，但未明确区分是侧重讲述品牌故事还是提升品牌认知。",
  "target_audience_refs": [],
  "required_context": [
    {
      "field_path": "selected_product_refs",
      "purpose": "做哪个商品：至少选定一个且在库",
      "availability": "AVAILABLE",
      "impact": "BLOCKING",
      "resolution_question": null,
      "related_source_refs": []
    },
    {
      "field_path": "business_goal",
      "purpose": "为什么做：商业目标六选一已解析；听不出来必须问，不许猜",
      "availability": "MISSING",
      "impact": "BLOCKING",
      "resolution_question": "这次用羊绒大衣建立品牌长期价值，更侧重于向用户解释品牌的设计哲学和价值观（比如为什么这样选料、牺牲了什么），还是更侧重让用户记住衡叙集这个品牌代表什么风格和态度？",
      "related_source_refs": []
    },
    {
      "field_path": "brand_id",
      "purpose": "哪个品牌：品牌身份明确（防串牌）",
      "availability": "AVAILABLE",
      "impact": "BLOCKING",
      "resolution_question": null,
      "related_source_refs": []
    },
    {
      "field_path": "platform",
      "purpose": "发到哪：本期仅视频号；其他平台不得静默适配",
      "availability": "AVAILABLE",
      "impact": "BLOCKING",
      "resolution_question": null,
      "related_source_refs": []
    }
  ],
  "missing_context": [
    {
      "field_path": "business_goal",
      "purpose": "为什么做：商业目标六选一已解析；听不出来必须问，不许猜",
      "availability": "MISSING",
      "impact": "BLOCKING",
      "resolution_question": "这次用羊绒大衣建立品牌长期价值，更侧重于向用户解释品牌的设计哲学和价值观（比如为什么这样选料、牺牲了什么），还是更侧重让用户记住衡叙集这个品牌代表什么风格和态度？",
      "related_source_refs": []
    }
  ],
  "assumptions": [],
  "confidence": {
    "level": "LOW",
    "basis": [
      "闸留痕：business_goal 来源：模型解析结果 goal_resolution=AMBIGUOUS（目标未落到六选一）",
      "闸留痕：clarification_question 落点：AMBIGUOUS，已用模型给出的澄清问题替换 business_goal 项的模板问句（B:285-286「提出一个最关键澄清问题」；被替换的模板句：'这条视频想达成什么？六选一：品牌认知 / 新品推广 / 转化 / 库存激活 / 品牌故事 / 用户教育。'）",
      "闸留痕：模型自报 confidence=MEDIUM，按缺失规则下调为 LOW（G6 只降不升）",
      "模型自述：任务原话明确指向品牌长期建设，排除了日常内容经营和转化类目标，但在品牌故事与品牌认知之间缺乏足够区分依据。",
      "确定性核对：goal_resolution=AMBIGUOUS，next_action=REQUEST_INPUT",
      "required_context / missing_context 由 OD-03 冻结清单逐项算出，非模型判断"
    ],
    "limiting_factors": [
      "商业目标尚未解析为六选一，任何结论都建立在未定目标上",
      "存在缺失上下文项，输出质量受限",
      "缺 business_goal（BLOCKING）：这次用羊绒大衣建立品牌长期价值，更侧重于向用户解释品牌的设计哲学和价值观（比如为什么这样选料、牺牲了什么），还是更侧重让用户记住衡叙集这个品牌代表什么风格和态度？"
    ]
  },
  "next_action": "REQUEST_INPUT",
  "trace_bundle": {
    "trace_bundle_id": "TB-28747718f0b6",
    "brand_id": "fixture-brand-01",
    "entries": [
      {
        "trace_id": "FACT:brand.positioning",
        "trace_type": "FACT",
        "statement": "brand.positioning = 服务 30—45 岁、需要在工作与日常之间切换的城市女性；中高端日常女装，主做有结构但不过度强势的外套、裤装、针织与半裙（status=CONFIRMED）",
        "source_refs": [
          {
            "source_id": "SRC-INTD03-0001",
            "brand_id": "fixture-brand-01",
            "source_type": "BRAND_OPERATOR_INPUT",
            "locator": "模拟",
            "captured_at": "2026-08-17T00:00:00+08:00",
            "checksum": null
          }
        ],
        "object_refs": [],
        "target_paths": [
          "brand.positioning"
        ],
        "supporting_trace_refs": [],
        "confidence": null
      },
      {
        "trace_id": "FACT:brand.values",
        "trace_type": "FACT",
        "statement": "brand.values = [\"先讲商品解决什么、牺牲什么，再谈是否值得买\", \"一件衣服应能进入真实生活，并在不同场景中被反复使用\", \"尊重具体身形、通勤方式、照料责任与预算，不把消费者简化成年龄标签\", \"内容以事实、判断和可验证细节建立信任，不靠密集促销维持关系\", \"保留个人表达，但不过度追逐短期流行\"]（status=CONFIRMED）",
        "source_refs": [
          {
            "source_id": "SRC-INTD03-0001",
            "brand_id": "fixture-brand-01",
            "source_type": "BRAND_OPERATOR_INPUT",
            "locator": "模拟",
            "captured_at": "2026-08-17T00:00:00+08:00",
            "checksum": null
          }
        ],
        "object_refs": [],
        "target_paths": [
          "brand.values"
        ],
        "supporting_trace_refs": [],
        "confidence": null
      },
      {
        "trace_id": "FACT:brand.target_customer_summary",
        "trace_type": "FACT",
        "statement": "brand.target_customer_summary = 她愿意为版型、面料与长期使用付合理溢价，但要求品牌把依据和不适合之处说清楚（status=CONFIRMED）",
        "source_refs": [
          {
            "source_id": "SRC-INTD03-0001",
            "brand_id": "fixture-brand-01",
            "source_type": "BRAND_OPERATOR_INPUT",
            "locator": "模拟",
            "captured_at": "2026-08-17T00:00:00+08:00",
            "checksum": null
          }
        ],
        "object_refs": [],
        "target_paths": [
          "brand.target_customer_summary"
        ],
        "supporting_trace_refs": [],
        "confidence": null
      },
      {
        "trace_id": "FACT:product.name",
        "trace_type": "FACT",
        "statement": "product.name = 10%羊绒风衣式大衣（status=CONFIRMED）",
        "source_refs": [
          {
            "source_id": "SRC-INTD03-0002",
            "brand_id": "fixture-brand-01",
            "source_type": "BRAND_OPERATOR_INPUT",
            "locator": "夹具虚构（剧本）",
            "captured_at": "2026-08-17T00:00:00+08:00",
            "checksum": null
          }
        ],
        "object_refs": [],
        "target_paths": [
          "product.name"
        ],
        "supporting_trace_refs": [],
        "confidence": null
      },
      {
        "trace_id": "FACT:product.style_attributes",
        "trace_type": "FACT",
        "statement": "product.style_attributes = [\"大翻领、廓形肩线、H型风衣式；袖口可调节袖袢；宽边长腰带\"]（status=CONFIRMED）",
        "source_refs": [
          {
            "source_id": "SRC-INTD03-0004",
            "brand_id": "fixture-brand-01",
            "source_type": "IMAGE_INPUT",
            "locator": "截图 IMG_0674、截图 IMG_0677、截图 IMG_0680",
            "captured_at": "2026-08-17T00:00:00+08:00",
            "checksum": null
          }
        ],
        "object_refs": [],
        "target_paths": [
          "product.style_attributes"
        ],
        "supporting_trace_refs": [],
        "confidence": null
      },
      {
        "trace_id": "R-BDD01-001",
        "trace_type": "RULE",
        "statement": "禁止低价叫卖表达（forbidden_expression: LOW_PRICE_SELLING）",
        "source_refs": [],
        "object_refs": [
          {
            "object_type": "RuleRecord",
            "object_id": "R-BDD01-001",
            "version": 1,
            "brand_id": "fixture-brand-01"
          }
        ],
        "target_paths": [
          "*"
        ],
        "supporting_trace_refs": [],
        "confidence": null
      },
      {
        "trace_id": "R-BDD01-002",
        "trace_type": "RULE",
        "statement": "促销让利路径违反高端品牌禁令（两候选降级分支冻结规则）",
        "source_refs": [],
        "object_refs": [
          {
            "object_type": "RuleRecord",
            "object_id": "R-BDD01-002",
            "version": 1,
            "brand_id": "fixture-brand-01"
          }
        ],
        "target_paths": [
          "strategy"
        ],
        "supporting_trace_refs": [],
        "confidence": null
      },
      {
        "trace_id": "R-FB01-001",
        "trace_type": "RULE",
        "statement": "禁止在任何输出中使用 fixture-brand-01 的品牌禁用表达；词表唯一真源为 acceptance/detectors/forbidden_lexicon.yaml（含 low_price_selling 与 false_scarcity 两组），本规则正文不复制词条；词表命中即违规，规则内容以该文件当前版本为准。",
        "source_refs": [],
        "object_refs": [
          {
            "object_type": "RuleRecord",
            "object_id": "R-FB01-001",
            "version": 1,
            "brand_id": "fixture-brand-01"
          }
        ],
        "target_paths": [
          "*"
        ],
        "supporting_trace_refs": [],
        "confidence": null
      }
    ],
    "target_artifact_ref": {
      "object_type": "IntentExecutionPlan",
      "object_id": "IEP-RUN-20260818T135846105713Z",
      "version": 1,
      "brand_id": "fixture-brand-01"
    }
  }
}
